title,en_title,de_title,es_title,ru_title,data,card_1,card_1_status,card_2,card_2_status,card_3,card_3_status,card_4,card_4_status,card_5,card_5_status,en_description,de_description,es_description,ru_description,possibility,menu_card_1,menu_card_2,menu_card_3,menu_card_4,menu_card_5
Three of a kind,Three of a kind,Drilling,"Trío","Сет (трипс)",three_of_kind,27.svg,active,14.svg,active,1.svg,active,17.svg,passive,2.svg,passive,"Three-of-a-kind is the next ranking hand after staring. It consists of any three cards of the same rank and any two other cards. If there are two or more players with a three-of-a-kind at showdown, the highest fourth card, also known as the ‘kicker’, decided who the winner is. If the fourth card did not determine the winner, the fifth card is considered. In a situation where all revealed three-of-a-kind hands are equal, the pot is split divided among the winning players. 

In Texas Hold’em and other flop games, three-of-a-kind is called a ‘set’. It is when a player has a pair on his private (hole) cards and one card of a matching rank on the board, for example, 5 - 5 on your hole cards and 5 on the board. Another possible type of three-of-a-kind is ‘trips’. it is made up of a matching pair on the board and one hole card, for example, 5 - 5 - 4 on the board and 5 on your hole cards.

There are 54.912 possible three-of-a-kind hands. The likelihood of being dealt such a combination is 2.1128%.","Der Drilling (Three-of-a-kind) ist die nächsthöhere Hand nach dem Staring. Sie besteht aus beliebigen drei Karten vom gleichen Wert sowie zwei beliebigen weiteren Karten. Gibt es beim Showdown zwei oder mehr Spieler mit einem Drilling, dann bestimmt die höchste vierte Karte, auch als „Kicker“ bezeichnet, den Gewinner. Konnte die vierte Karte den Gewinner nicht bestimmen, wird die fünfte Karte herangezogen. In dem Fall, in dem alle aufgedeckten Hände mit Drillingen gleichwertig sind, wird der Pot zwischen den Gewinnern aufgeteilt.

In Texas Hold’em und anderen Flop-Spielen werden Drillinge als „Set“ bezeichnet. Das bedeutet, dass ein Spieler ein Paar in seinen Hole Cards (verdeckten Karten) besitzt und eine gleichwertige Karte auf dem Board liegt, z.B. 5 - 5 in seinen Hole Cards und 5 auf dem Board. Eine andere Möglichkeit für Drillinge ist das sogenannte „Trips“. Es wird aus einem Paar auf dem Board und einer Hole Card gebildet, z.B. 5 - 5 - 4 auf dem Board und fünf in den Hole Cards.

Es gibt 54,912 Möglichkeiten für eine Hand mit Drillingen. Die Wahrscheinlichkeit, eine solche Kombination zu erhalten, liegt bei 2,1128 %.
","El trío es la siguiente mano después de la escalera. Consiste en tres cartas cualesquiera del mismo valor y otras dos cartas cualesquiera. Si hay dos o más jugadores con un trío cuando se muestran todas las cartas, se elige como ganador al que tenga la cuarta carta más alta, también conocida como “kicker”. Si la cuarta carta no determinase al jugador, este se decidiría según la quinta carta. En una situación en la que todas las manos de tríos tengan el mismo valor, el bote se divide entre los jugadores que hayan ganado.

En Texas Hold’em y partidas con flop, al trío se le denomina “set”. Esto se produce cuando un jugador tiene una pareja en sus cartas de mano y una carta del mismo valor en la mesa, por ejemplo, 5 - 5 en tus cartas de mano y 5 en la mesa. Otro tipo posible de trío es “trips”. Está formado por una pareja en la mesa y una carta de mano, por ejemplo, 5 - 5 - 4 en la mesa y 5 en tus cartas de mano.

Hay 54.912 manos de tríos posibles. La probabilidad de que recibas esta combinación es del 2,1128 %.
","Сет — это следующая по старшинству комбинация после стрейта. Она состоит из трех карт одинакового ранга и двух любых других карт. Из нескольких сетов на шоудауне выигрывает тот, чья четвертая карта — ""кикер"" — будет старше. Если четвертая карта одинакова, в игру вступает пятая карта. Если и она не помогает определить победителя, сеты считаются равноценными, и банк делится.

В Texas Hold’em и других играх с флопом сетом называется определенная комбинация из закрытых карт игрока и общих карт. Для составления сета две карты одного ранга должны быть на руках у игрока (закрытые карты), а третья карта этого ранга должна лежать на борде. Например, 5 - 5 на руках и 5 на борде. Еще одна комбинация из трех карт одинакового ранга называется ""трипс"". Она составляется из пары на борде и одной закрытой карты на руках у игрока. Например, 5 - 5 - 4 на борде и 5 в закрытых картах.

Существует 54.912 возможных комбинаций сетов. Вероятность собрать такую комбинацию составляет 2,1128%.",2.1128%,44.svg,6.svg,24.svg,11.svg,37.svg
Two pairs,Two pairs,Zwei Paare,"Doble pareja","Две пары (допер)",two_pairs,11.svg,active,24.svg,active,8.svg,active,21.svg,active,45.svg,passive,"Two pair speaks for itself. It is basically a poker hand made up of two pairs of a different rank and any other card. If there are several players with a two pair, they are compared by the highest pair in each hand. The best two pair wins the pot. If the highest pairs are equal, the second pair determine the winner. If none of the pairs can be used to determine the winner, the player with the highest fifth card, also called the ‘kicker’, gets all the money from the pot. It is also possible that two players have absolutely equal two pairs, in that case the pot is split between them. 

There are 123.552 possible two pair hands, making it one of the most winning hands. This is  4.7539% chances of being dealt one.","Zwei Paare sprechen für sich selbst. Das ist einfach eine Pokerhand, die aus zwei Paaren unterschiedlichen Wertes und einer weiteren Karte besteht. Gibt es mehrere Spieler mit zwei Paaren, dann werden sie anhand ihres jeweils höchsten Paares verglichen. Derjenige mit den beiden besten Paaren gewinnt den Pot. Sind die beiden höchsten Paare gleichwertig, bestimmt das zweite Paar den Gewinner. Kann der Gewinner nicht anhand der Paare bestimmt werden, dann erhält der Spieler mit der höchsten fünften Karte, auch „Kicker“ genannt, das ganze Geld aus dem Pot. Auch ist es möglich, dass beide Spieler zwei absolut gleiche Paare haben. In diesem Fall wird der Pot zwischen ihnen aufgeteilt.

Es gibt 123.552 mögliche Hände mit zwei Paaren, wodurch dieses eine der häufigsten Gewinnhände ist.. Die Chance, eine solche Hand ausgeteilt zu bekommen, liegt bei 4,7539 %.
","La doble pareja habla por sí sola. Básicamente es una mano de poker formada por dos parejas de distinto valor y cualquier otra carta. Si hay varios jugadores con doble pareja, se compara la pareja más alta en cada mano. La mejor doble pareja gana el bote. Si las parejas más altas tienen el mismo valor, la segunda pareja determina al ganador. Si no se puede utilizar ninguna de las parejas para determinar al ganador, el jugador con la quinta carta más alta, también conocida como “kicker”, se lleva el dinero del bote. También puede ocurrir que dos jugadores consigan una doble pareja completamente igual, por lo que se divide el bote entre ellos.

Hay 123.552 manos de doble pareja posibles, lo que convierte a esta mano en una de las más ganadoras. La probabilidad de que recibas esta combinación es del 4,7539 %.
","Название ""две пары"" говорит само за себя. По сути, это покерная комбинация из двух разных пар и любой другой пятой карты. Среди нескольких комбинаций двух пар победитель определяется рангом карт, из которых состоит старшая пара в комбинации. Лучшие две пары выигрывают банк. Если старшая пара в комбинации одинакова, смотрится вторая пара. Если обе пары в комбинациях игроков одинаковы, в игру вступает пятая карта — ""кикер"". Банк выигрывают две пары со старшим кикером. Возможна ситуация, когда комбинации двух пар у нескольких игроков абсолютно одинаковы, и в таком случае банк делится.

Существует 123.552 возможные комбинации двух пар, т.е. это одна из самых популярных выигрышных рук. Шансы собрать ее равны 4,7539%.",4.7539%,15.svg,52.svg,39.svg,1.svg,27.svg
Pair,Pair,"Paar","Pareja","Пара",pair,12.svg,active,51.svg,active,3.svg,passive,32.svg,passive,18.svg,passive,"One pair is a poker hand rank that consists of two cards of the same rank and any three other cards. If there are two or more players with one pair, a player with the highest card value pair wins the pot. If a few players have the same pair, other three cards, or the ‘kickers’, are used to determine the winner. The player with the highest non-pair card wins all the money in the pot. In a situation when several players have the pair and three cards of the same value, the pot is split among them. 

There are 1.098.240 possible one pair hands. That makes the chances of being dealt one very high at 42.2569%.","Ein Paar ist eine Pokerhand, die aus zwei Karten desselben Wertes und drei anderen beliebigen Karten besteht.. Haben zwei oder mehr Spieler ein Paar, dann gewinnt der Spieler mit dem höchstwertigen Paar den Pot. Haben mehrere Spieler das gleiche Paar, dann wird der Gewinner anhand der anderen drei Karten, der „Kicker“, bestimmt. Der Spieler mit der höchsten nicht im Paar befindlichen Karte gewinnt das ganze Geld im Pot. Im Fall, dass mehrere Spieler ein Paar und die zusätzlichen Karten vom selben Wert haben, wird der Pot zwischen ihnen aufgeteilt.

Es gibt 1.098.240 mögliche Hände mit einem Paar. Somit liegt die Chance, eines ausgeteilt zu bekommen, mit 42,2569 % sehr hoch.
","Una pareja es una mano de poker que consiste en dos cartas del mismo valor y otras tres cartas diferentes. Si hay dos o más jugadores con una pareja, el jugador con la pareja de cartas con el valor más alto gana el bote. Si varios jugadores tienen la misma pareja, las otras tres cartas, o “kickers” se usan para decidir al ganador. El jugador con la carta sin pareja más alta se lleva todo el dinero del bote. En caso de que varios jugadores tengan la pareja y las tres cartas del mismo valor, el bote se divide entre ellos.

Hay 1.098.240 manos de posibles parejas. Esto hace que la probabilidad de que recibas esta combinación sea muy alta, del 42,2569 %
","Пара — это покерная комбинация из двух одинаковых карт и трех любых других карт. Среди нескольких пар банк выигрывает старшая. Если у нескольких игроков одинаковая пара, победитель определяется по трем другим картам — ""кикерам"". Банк в таком случае выигрывает игрок со старшей непарной картой. Если и пара, и три другие карты у нескольких игроков одинаковы, банк делится.

Всего в покере возможны 1.098.240 пар. Шансы собрать одну из них весьма велики — 42,2569%.",42.2569%,41.svg,4.svg,20.svg,49.svg,10.svg
High card,High card,"Höchste Karte","Carta más alta","Старшая карта",high_card,1.svg,active,22.svg,passive,41.svg,passive,33.svg,passive,3.svg,passive,"No pair is the lowest possible hand that contains any cards.  If a few players play no pair at showdown, the highest top card determines the winner. If all top cards are equal in value, the next highest ranking card from each hand is compared, and so on until a difference is found. If players have absolutely the same no pairs, the pot is split among them. It is not the end of the world if you get a no pair, as here is still a chance to win money form the pot if all the other players fold or have the same ranking hand at showdown.

There are 2.598.960 possible five card combinations. The chances of being dealt a no pair 50.1177%.","Kein Paar ist die niedrigste mögliche Hand, die überhaupt Karten enthält. Wenn mehrere Spieler beim Showdown kein Paar spielen, dann bestimmt die höchste Karte den Gewinner. Sind alle höchsten Karten gleichwertig, wird die nächsthöchste Karte von jeder Hand verglichen usw., bis eine Differenz gefunden wird. Haben die Spieler absolut die gleichen Hände ohne Paar, dann wird der Pot zwischen ihnen aufgeteilt. Wenn Sie kein Paar erhalten, ist das nicht das Ende der Welt, denn es besteht immer noch die Chance, Geld aus dem Pot zu gewinnen, wenn alle anderen Spieler passen oder beim Showdown gleichwertige Hände haben.

Es gibt 2.598.960 mögliche Kombinationen aus fünf Karten. Die Wahrscheinlichkeit, kein Paar ausgeteilt zu bekommen, liegt bei 50,1177 %.
","Sin pareja es la mano más baja posible y no contiene ninguna combinación de cartas. Si varios jugadores no presentan ninguna pareja cuando se muestran las cartas, la carta más alta determina el ganador. Si todas las cartas más altas son del mismo valor, se compara la siguiente carta más alta de cada mano sucesivamente hasta que se encuentre una diferente. Si ninguno de los jugadores tiene pareja y presentan las mismas cartas, el bote se divide entre ellos. No es el fin del mundo si no consigues ninguna pareja: aún tienes probabilidades de ganar dinero del bote si el resto de jugadores se retiran o presentan una mano del mismo valor cuando se muestran todas las cartas.

Hay 2.598.960 posibles combinaciones de cinco cartas diferentes. La probabilidad de no conseguir ninguna pareja es del 50,1177 %.
","Комбинация без пар — самая младшая, она состоит из любых, никак не связанных друг с другом карт. Если несколько игроков показывают такую комбинацию на шоудауне, выигрывает старшая карта. Если старшие карты во всех комбинациях одинаковы, смотрится следующая по старшинству карта и т.д., пока не будет определен победитель. Если комбинации абсолютно одинаковы, банк делится. Если вам не удалось собрать даже пару, не огорчайтесь, у вас по-прежнему есть шансы выиграть деньги из банка. Другие игроки могут сброситься, или же на шоудауне у них окажутся такие же комбинации или даже младше.

Существует 2.598.960 возможных пятикарточных комбинаций. Шансы получить непарную комбинацию составляют 50,1177%.
",50.1177%,42.svg,7.svg,9.svg,38.svg,40.svg