id,title,description,picture,caption,link
texas-holdem,Texas Holdem - an iteractive poker guide by 888poker,"This visual guide will teach you how to play the most popular card game in the world in no time. Don't waste time, learn Texas Holdem and start your first hand right now.",http://game888-2.s3-website-eu-west-1.amazonaws.com/images/facebook-share.jpg,888poker,www.888poker.com
omaha,Omaha Hi - an iteractive poker guide by 888poker,Omaha Hi (PLO) visual guide is the perfect place to start learning this exiting poker game brought to you by 888poker. Get the inside scoop on how to play Omaha in a few steps.,http://game888-2.s3-website-eu-west-1.amazonaws.com/images/facebook-share.jpg,888poker,www.888poker.com
omaha-hi-lo,Omaha Hi-Lo - an iteractive poker guide by 888poker,Omaha Hi-Lo is one of the most popular poker games with two winners. Learn how to play this exciting game with our 888poker visual guide and get the your chance to win twice more time!,http://game888-2.s3-website-eu-west-1.amazonaws.com/images/facebook-share.jpg,888poker,www.888poker.com
seven-card-stud,7 Card Stud - an iteractive poker guide by 888poker,"Would you like to try something different from Texas Holdem poker? It's the right time to learn Seven Card Stud, aslo known as the ""father of poker"". You can do it in now time with our visual guide.",http://game888-2.s3-website-eu-west-1.amazonaws.com/images/facebook-share.jpg,888poker,www.888poker.com
snap,SNAP poker - an iteractive poker guide by 888poker,SNAP poker is a fast-fold game format designed to reduce the time between your fold and new hand. Learn SNAP today and play more hands in shorter time.,http://game888-2.s3-website-eu-west-1.amazonaws.com/images/facebook-share.jpg,888poker,www.888poker.com
default,The Game - an Interactive Poker Guide by 888poker,Get the inside scoop on how to play the most popular poker games in a few steps.,http://game888-2.s3-website-eu-west-1.amazonaws.com/images/facebook-share.jpg,888poker,www.888poker.com