game_id,title,stage_id,intro,step_id,,en_title,en_intro,de_title,de_intro,es_title,es_intro,ru_title,ru_intro
Omaha HI,Flop,omaha_hi_flop,"Once the pre-flop round has finished, three face-up community cards are dealt on the poker table. These cards make up what is called the flop. A second round of betting begins.

The first player to act is the first player still active in the game to the left of the dealer. This player has two options: check or place a bet. The action moves clockwise around the table. If the first player checks, the next player has those two same options. Once an initial bet is placed, the other players can call, raise, fold or raise pot.",omaha_hi_flop_0,,Flop,"Once the pre-flop round has finished, three face-up community cards are dealt on the poker table. These cards make up what is called the flop. A second round of betting begins.

The first player to act is the first player still active in the game to the left of the dealer. This player has two options: check or place a bet. The action moves clockwise around the table. If the first player checks, the next player has those two same options. Once an initial bet is placed, the other players can call, raise, fold or raise pot.",Flop,"Nach Abschluss der Pre-Flop-Runde werden drei Gemeinschaftskarten offen auf dem Pokertisch ausgegeben. Diese Karten bilden den so genannten Flop. Anschließend beginnt eine zweite Einsatzrunde.

Der erste Spieler, der agiert, ist der erste Spieler links vom Dealer, der noch aktiv im Spiel ist. Dieser Spieler hat zwei Optionen: Schieben oder Setzen. Die Action bewegt sich im Uhrzeigersinn um den Tisch. Wenn der erste Spieler schiebt, hat der nächste Spieler die gleichen beiden Optionen. Nachdem ein Anfangseinsatz gesetzt wurde, können die übrigen Spieler mitgehen, erhöhen, aussteigen oder den Pot erhöhen.
",Flop,"Una vez que la ronda del pre-flop ha terminado, tres cartas comunitarias son colocadas boca arriba en la mesa de póquer. Estas cartas son lo que se llama el flop. Una segunda ronda de apuestas comienza.

El primer jugador en actuar es el primer jugador activo en el juego a la izquierda del crupier. Este jugador tiene dos opciones: pasar o apostar. La acción se mueve en el sentido de las agujas del reloj alrededor de la mesa. Si el primer jugador pasa, el siguiente jugador tiene las mismas dos opciones. Una vez que una apuesta es colocada, los otros jugadores pueden igualarla, aumentarla, retirarse o aumentar el pozo.
",Флоп,"Как только раунд префлопа завершился, на покерный стол сдаются три открытые общие карты. Эти карты составляют то, что называется флопом. Начинается второй раунд торгов.

Первым ходит первый активный игрок слева от дилера. У этого игрока есть два варианта хода: сделать чек или ставку. Ход продвигается по столу по часовой стрелке. Если первый игрок отказывается делать ставку, у следующего игрока есть те же два варианта хода. Как только будет сделана изначальная ставка, остальные игроки смогут уравнять ставку, поднять ее, пасовать или поднять банк.
"
Omaha HI,Turn,omaha_hi_turn,"After the betting action is completed for the flop round, a fourth face-up community card is dealt on the table. This card is referred to as the turn. A third round of betting begins.

The first player to act is the first player still in the game, seated on the dealer's left. The action moves clockwise around the table. The first player to act has two options: check or bet. Once an initial bet is made, the other players in the hand can also call, raise, fold or raise pot, which could put them all-in.",omaha_hi_turn_0,,Turn,"After the betting action is completed for the flop round, a fourth face-up community card is dealt on the table. This card is referred to as the turn. A third round of betting begins.

The first player to act is the first player still in the game, seated on the dealer's left. The action moves clockwise around the table. The first player to act has two options: check or bet. Once an initial bet is made, the other players in the hand can also call, raise, fold or raise pot, which could put them all-in.",Turn,"Nach Abschluss des Setzens für die Flop-Runde wird eine vierte Gemeinschaftskarte offen auf dem Pokertisch ausgegeben. Diese Karte wird als „Turn“ bezeichnet. Anschließend beginnt eine dritte Einsatzrunde.

Der erste Spieler, der agiert, ist der erste Spieler links vom Dealer, der noch im Spiel ist. Die Action bewegt sich im Uhrzeigersinn um den Tisch. Der erste agierende Spieler hat zwei Optionen: Schieben oder Setzen. Nachdem ein Eröffnungseinsatz gesetzt wurde, können die anderen Spieler in der Hand mitgehen, erhöhen, aussteigen oder den Pot erhöhen, was möglicherweise einen All-In erforderlich macht.
",Turn,"Después de que la acción de apuesta haya sido completada para la ronda de flop, una cuarta común boca arriba es colocada en la mesa. A esta carta se le conoce como el turn. Una tercera ronda de apuestas comienza.

El primer jugador en actuar es el primer jugador activo en el juego a la izquierda del crupier. La acción se mueve en el sentido de las agujas del reloj alrededor de la mesa. El primer jugador en actuar tiene dos opciones: pasar o apostar. Una vez que una apuesta inicial es colocada, los otros jugadores en la mano pueden igualarla, aumentarla, retirarse o aumentar el pozo lo cual podría ponerlo en all-in.
",Терн,"После того, как завершатся ставки во флоп-раунде, на стол в открытую выкладывается четвертая общая карта. Эта карта называется терном. Начинается третий раунд торгов.

Первым ходит первый оставшийся в игре игрок, сидящий слева от дилера. Ход продвигается по столу по часовой стрелке. У первого игрока есть два варианта хода: сделать чек или ставку. Как только будет сделана изначальная ставка, остальные игроки этой партии могут также уравнять ставку, поднять ее, пасовать или поднять банк, вплоть до олл-ина.
"
Omaha HI,River,omaha_hi_river,"After the turn round has finished, the fifth and last face-up community card is placed on the table. This card is called the river. The fourth and last betting round begins.

As in the previous three rounds, the betting starts with the first player to the left of the dealer, who is still active in the hand. This player has two options: to check or bet. Once an initial bet is placed, other players can call, raise, fold or raise pot, which could put them all-in. Action then moves clockwise around the table.",omaha_hi_river_0,,River,"After the turn round has finished, the fifth and last face-up community card is placed on the table. This card is called the river. The fourth and last betting round begins.

As in the previous three rounds, the betting starts with the first player to the left of the dealer, who is still active in the hand. This player has two options: to check or bet. Once an initial bet is placed, other players can call, raise, fold or raise pot, which could put them all-in. Action then moves clockwise around the table.",River,"Nach Abschluss der Turn-Runde wird die fünfte und letzte Gemeinschaftskarte offen auf dem Pokertisch ausgegeben. Diese Karte wird als „River“ bezeichnet. Anschließend beginnt die vierte und letzte Einsatzrunde.

Wie in den vorherigen drei Runden beginnt das Setzen mit dem ersten Spieler links vom Dealer, der in der Hand noch aktiv ist. Dieser Spieler hat zwei Optionen: Schieben oder Setzen. Nachdem ein Eröffnungseinsatz gesetzt wurde, können die übrigen Spieler mitgehen, erhöhen, aussteigen oder den Pot erhöhen, was möglicherweise einen All-In erforderlich macht. Die Action bewegt sich anschließend im Uhrzeigersinn um den Tisch.
",River,"Una vez que la ronda del turn ha terminado, la quinta carta común es colocada boca arriba en la mesa. Esta carta es llamada el river. Una tercera y última ronda de apuestas comienza.Tal como en las tres rondas previas, las apuestas comienzan con el primer jugador a la izquierda del crupier que esté activo en la mano. Este jugador tiene dos opciones: pasar o apostar. Una vez que una apuesta es colocada, los otros jugadores pueden igualarla, aumentarla, retirarse o aumentar el pozo, lo cual podría ponerlos en all-in. Entonces, la acción se mueve en el sentido de las agujas del reloj alrededor de la mesa.",Ривер,"Как только завершится раунд терна, на стол в открытую сдается пятая и последняя общая карта. Эта карта называется «ривер». Начинается четвертый и последний раунд торгов.

Как и в трех предыдущих раундах, торги начинаются с первого игрока слева от дилера, который все еще остается в игре. У этого игрока есть два варианта хода: сделать чек или ставку. Как только будет сделана изначальная ставка, остальные игроки могут уравнять ставку, поднять ее, пасовать или поднять банк, вплоть до олл-ина. После этого ход продвигается по столу по часовой стрелке.
"
Omaha HI,Showdown,omaha_hi_showdown,"After the final betting round ends and all the money is in the pot, it is time for the players who are still in the hand to reveal their cards. The winner is the player with the best five-card combination, also known as the hand. Showdown only occurs if more than one player is active in a hand. If only one player makes it to this stage, they will win all the money in the pot. ",omaha_hi_showdown_0,,Showdown,"After the final betting round ends and all the money is in the pot, it is time for the players who are still in the hand to reveal their cards. The winner is the player with the best five-card combination, also known as the hand. Showdown only occurs if more than one player is active in a hand. If only one player makes it to this stage, they will win all the money in the pot. ",Showdown,"Nachdem die letzte Einsatzrunde beendet ist und sich das Geld im Pot befindet, ist es für die in der Hand verbliebenen Spieler an der Zeit, ihre Karten zu zeigen. Der Gewinner ist der Spieler mit der besten Kombination von fünf Karten, auch als „Hand“ bezeichnet. Ein Showdown findet nur statt, wenn es in einer Hand mehr als einen aktiven Spieler gibt. Wenn nur ein Spieler noch aktiv ist, gewinnt er das gesamte Geld, das sich im Pot befindet. ",Mostrar,"Después de que la ronda final de apuestas termina y todo el dinero está en el pozo, es tiempo de que los jugadores que aún siguen en juego muestren sus cartas. El ganador es el jugador con la mejor combinación de cinco cartas, también conocida como mano. Sólo se debe mostrar si hay más de un jugador activo en la mano. Si sólo un jugador llega hasta esta etapa, gana todo el dinero que hay en el pozo. ",Раскрытие карт,"После того, как завершился последний раунд торгов и все деньги оказались в банке, пришло время игрокам, оставшимся в игре, раскрыть свои карты. Выигрывает игрок с лучшей пятикарточной комбинацией, известной как рука. Карты раскрываются, если в игре остается больше одного участника. Если до этого этапа доходит только один игрок, он выигрывает все деньги в банке. "
Omaha HI/LO,Deal,omaha_hi_lo_deal,"Once all players are gathered around the table with the relevant amount of chips, there are a few steps to be taken before the game commences. 

Firstly, a player indicated by ‘the dealer’ marker (‘D') is the designated dealer for the current game.

Secondly, two compulsory bets are taken. The player to the left of the dealer button posts the first forced bet, called ‘the small blind’. The player to the left of the small blind posts the second mandatory bet called ‘the big blind’. The big blind is twice the amount of the small blind.

Finally, each player is dealt four face-down hole cards.",omaha_hi_lo_deal_0,,Deal,"Once all players are gathered around the table with the relevant amount of chips, there are a few steps to be taken before the game commences. 

Firstly, a player indicated by ‘the dealer’ marker (‘D') is the designated dealer for the current game.

Secondly, two compulsory bets are taken. The player to the left of the dealer button posts the first forced bet, called ‘the small blind’. The player to the left of the small blind posts the second mandatory bet called ‘the big blind’. The big blind is twice the amount of the small blind.

Finally, each player is dealt four face-down hole cards.",Austeilen,"Wenn alle Spiel am Tisch mit der entsprechenden Menge von Chips versammelt sind, müssen einige Schritte ausgeführt werden, bevor das Spiel beginnen kann.

Zunächst wird ein Spieler, der durch die „Dealer“-Markierung („D“) gekennzeichnet wird, als Dealer für das aktuelle Spiel festgelegt.

Als Nächstes werden zwei Eröffnungseinsätze genommen. Der Spieler links vom Dealer-Button macht den ersten Eröffnungseinsatz, als „Small Blind“ bezeichnet. Der Spieler links vom Small Blind macht den zweiten Eröffnungseinsatz, als „Big Blind“ bezeichnet. Der Big Blind beträgt das Zweifache des Small Blind.

Und schließlich werden jedem Spieler verdeckt vier Taschenkarten ausgeteilt.
",Reparto,"Una vez que todos los jugadores estén reunidos alrededor de la mesa con una cantidad de fichas relevante, hay que realizar unos pocos pasos antes de que el juego comience.Primero, un jugador con el marcador de 'el crupier' ('D') es designado crupier para el juego corriente.Segundo, dos apuestas obligatorias se deben realizar. El jugador a la izquierda del marcador de crupier coloca la primera apuesta forzada, llamada 'la ciega pequeña'. El jugador a la izquierda de la ciega pequeña coloca la segunda apuesta forzada, llamada 'la ciega grande'. La ciega grande es el doble de la ciega pequeña.Finalmente, a cada jugador se le reparten cuatro cartas de mano boca abajo",Раздача,"После того как все игроки собрались за покерным столом с соответствующим количеством фишек, нужно выполнить несколько действий, прежде чем начать игру.

Во-первых, игрок, обозначенный маркером «дилер» («D»), назначается дилером текущей игры.

Во-вторых, нужно сделать две обязательные ставки. Игрок слева от фишки дилера делает первую обязательную ставку, которая называется «малым блайндом». Игрок слева от малого блайнда делает вторую обязательную ставку, которая называется «большим блайндом». Большой блайнд должен быть в два раза больше малого блайнда.

И наконец, каждому игроку сдаются четыре закрытые карты.
"
Omaha HI/LO,Pre-Flop,omaha_hi_lo_pre_flop,"Once the small and big blinds have been posted and all players have been dealt four hole cards, the first round of betting begins. This round is called the pre-flop. The player to the left of the big blind acts first, and only one player can act at a time. The betting action moves clockwise around the table. Each player has the following four options: call, raise, fold or raise pot, in the pot-limit versions of this game. With no prior raise, the big blind can also check.",omaha_hi_lo_pre_flop_0,,Pre-Flop,"Once the small and big blinds have been posted and all players have been dealt four hole cards, the first round of betting begins. This round is called the pre-flop. The player to the left of the big blind acts first, and only one player can act at a time. The betting action moves clockwise around the table. Each player has the following four options: call, raise, fold or raise pot, in the pot-limit versions of this game. With no prior raise, the big blind can also check.",Pre-Flop,"Nachdem der Small Blind und der Big Blind gesetzt wurden und allen Spielern vier Taschenkarten ausgeteilt wurden, beginnt die erste Einsatzrunde. Diese Runde wird als „Pre-Flop“ bezeichnet. Der Spieler links vom Big Blind setzt als erster. Es kann jeweils nur ein Spieler setzen. Die Einsätze bewegen sich im Uhrzeigersinn um den Tisch. Jedem Spieler stehen die folgenden vier Optionen zur Verfügung: mitgehen, erhöhen, aussteigen (oder den Pot erhöhen, in den Pot-Limit-Versionen dieses Spiels). Wenn zuvor nicht erhöht wurde, kann der Big Blind auch schieben.",Pre-Flop,"Una vez que las ciegas grande y pequeña hayan sido colocadas y que todos los jugadores haya recibido sus cuatro cartas de mano, la primera ronda de apuestas comienza. Esta ronda es llamada el pre-flop. El jugador a la izquierda de la ciega grande actúa primero, y solo un jugador actúa a la vez. La acción de la apuesta se mueve en sentido de las agujas del reloj alrededor de la mesa. Cada jugador tiene las siguientes cuatro opciones: igualar, aumentar, retirarse o aumentar el pozo, en las versiones con límite de pozo de este juego. En caso de no haber un aumento, la ciega grande también puede pasar.",Префлоп,"После размещения малого и большого блайндов и раздачи всем игрокам по четыре закрытые карты начинается первый раунд торгов. Этот раунд называется префлопом. Игрок слева от большого блайнда делает первый ход. За раз может ходить только один игрок. Ход торгов продвигается по столу по часовой стрелке. У каждого игрока есть четыре варианта хода: они могут уравнять ставку, поднять ее, пасовать или поднять банк (в разновидностях игры с пот-лимитом). Без предварительного рейза игрок с большим блайндом также может сделать чек."
Omaha HI/LO,Flop,omaha_hi_lo_flop,"Once the pre-flop round has finished, three face-up community cards are dealt on the poker table. These cards make up what is called the flop. A second round of betting begins.

The first player to act is the first player still active in the game to the left of the dealer. This player has two options: check or place a bet. The action moves clockwise around the table. If the first player checks, the next player has those two same options. Once an initial bet is placed, the other players can call, raise, fold or raise pot in Omaha pot-limit variations. ",omaha_hi_lo_flop_0,,Flop,"Once the pre-flop round has finished, three face-up community cards are dealt on the poker table. These cards make up what is called the flop. A second round of betting begins.

The first player to act is the first player still active in the game to the left of the dealer. This player has two options: check or place a bet. The action moves clockwise around the table. If the first player checks, the next player has those two same options. Once an initial bet is placed, the other players can call, raise, fold or raise pot in Omaha pot-limit variations. ",Flop,"Nach Abschluss der Pre-Flop-Runde werden drei Gemeinschaftskarten offen auf dem Pokertisch ausgegeben. Diese Karten bilden den so genannten Flop. Anschließend beginnt eine zweite Einsatzrunde.Der erste Spieler, der agiert, ist der erste Spieler links vom Dealer, der noch aktiv im Spiel ist. Dieser Spieler hat zwei Optionen: Schieben oder Setzen. Die Action bewegt sich im Uhrzeigersinn um den Tisch. Wenn der erste Spieler schiebt, hat der nächste Spieler die gleichen beiden Optionen. Nachdem ein Anfangseinsatz gesetzt wurde, können in Omaha pot-limit-Varianten die übrigen Spieler mitgehen, erhöhen, aussteigen oder den Pot erhöhen. ",Flop,"Una vez que la ronda del pre-flop ha terminado, tres cartas comunitarias son colocadas boca arriba en la mesa de póquer. Estas cartas son lo que se llama el flop. Una segunda ronda de apuestas comienza.El primer jugador en actuar es el primer jugador activo en el juego a la izquierda del crupier. Este jugador tiene dos opciones: pasar o apostar. La acción se mueve en el sentido de las agujas del reloj alrededor de la mesa. Si el primer jugador pasa, el siguiente jugador tiene las mismas dos opciones. Una vez que una apuesta es colocada, los otros jugadores pueden igualarla, aumentarla, retirarse o aumentar el pozo en las variaciones del Omaha pot-limit. ",Флоп,"Как только раунд префлопа завершился, на покерный стол сдаются три открытые общие карты. Эти карты составляют то, что называется флопом. Начинается второй раунд торгов.

Первым ходит первый активный игрок слева от дилера. У этого игрока есть два варианта хода: сделать чек или ставку. Ход продвигается по столу по часовой стрелке. Если первый игрок отказывается делать ставку, у следующего игрока есть те же два варианта хода. Как только будет сделана изначальная ставка, остальные игроки смогут уравнять ставку, поднять ее, пасовать или поднять банк (в некоторых разновидностях Omaha pot-limit). "
