game_id,title,stage_id,intro,step_id,,en_title,en_intro,de_title,de_intro,es_title,es_intro,ru_title,ru_intro
7 Card Stud,Fourth Street,seven_card_stud_fourth_street,"When the first betting round has finished with all the current bets in the pot, each player still in the game is dealt one additional card (face-up). A second betting round begins.

Starting from this round on, the first player to act is always the player with the highest valued door cards. Their options are to check (place no bet) or post the lower table limit. If the player with the highest valued door cards shows a pair, they have the additional option of betting double the lower table limit. 

The betting action moves clockwise around the table. Each player has the following options: call, raise or fold. With no prior bet, players can also check. 

All raised bets in the second round should be equal to the lower table limit (unless the player with the highest valued hand has a pair and raises it to the table’s higher limit).",seven_card_stud_fourth_street_0,,Fourth Street,"When the first betting round has finished with all the current bets in the pot, each player still in the game is dealt one additional card (face-up). A second betting round begins.

Starting from this round on, the first player to act is always the player with the highest valued door cards. Their options are to check (place no bet) or post the lower table limit. If the player with the highest valued door cards shows a pair, they have the additional option of betting double the lower table limit. 

The betting action moves clockwise around the table. Each player has the following options: call, raise or fold. With no prior bet, players can also check. 

All raised bets in the second round should be equal to the lower table limit (unless the player with the highest valued hand has a pair and raises it to the table’s higher limit).",Die „Fourth Street“,"Wenn die erste Einsatzrunde abgeschlossen ist und alle aktuellen Einsätze in den Pot eingezahlt wurden, wird jedem Spieler, der noch am Spiel teilnimmt, eine weitere Karte (offen) ausgeteilt. Es beginnt die zweite Einsatzrunde.

Ab dieser Runde fängt immer der Spieler mit den jeweils höchsten Door Cards an. Er hat die Wahl, entweder zu schieben (keinen Einsatz zu entrichten) oder den Mindesteinsatz zu setzen. Wenn der Spieler mit den höchsten Door Cards ein Paar hat, hat er zusätzlich die Möglichkeit, den doppelten Mindesteinsatz zu setzen.

Die Einsatzrunde läuft im Uhrzeigersinn um den Tisch. Jeder Spieler hat folgende Möglichkeiten: mitgehen, erhöhen oder aussteigen. Ohne vorherigen Einsatz haben Spieler auch die Möglichkeit zu schieben.

Alle Einsatzerhöhungen in der zweiten Runde müssen dem Mindesteinsatz entsprechen (es sei denn, der Spieler mit den höchsten offenen Karten hat ein Paar und beschließt, auf den Höchsteinsatz des Tisches zu erhöhen).
",Cuarta Calle,"Cuando la primera ronda de apuestas termine con todas las apuestas en curso en el pozo, se reparte una carta adicional (boca arriba) a cada jugador que no se haya retirado del juego. Comienza una segunda ronda de apuestas.

A partir de esta ronda, el primer jugador en actuar será siempre el jugador con la primera carta expuesta de mayor valor. Las opciones que tiene son las de pasar (no realizar ninguna apuesta) o apostar el límite mínimo de la mesa. Si el jugador con la primera carta expuesta de mayor valor muestra una pareja, tiene la opción adicional de apostar el doble del límite mínimo de la mesa.

Las apuestas se realizan de izquierda a derecha alrededor de la mesa. Cada jugador cuenta con estas opciones: igualar, subir o retirarse. Los jugadores también pueden pasar si no hay apuesta previa.

Todas las subidas en la segunda ronda deberán ser equivalentes al límite mínimo de la mesa (a menos que el jugador que tenga la mano con el valor más alto tenga una pareja y la suba hasta límite máximo de la mesa).
",Четвертая улица,"После окончания первого раунда ставок, когда все текущие ставки собраны в банк, каждый оставшийся в раздаче игрок получает одну дополнительную карту (открытую). Начинается второй раунд торговли.

С этого раунда первым всегда принимает решение игрок со старшими дор-картами. Он может чекнуть (пропустить ставку) или сделать малую ставку. Если у игрока со старшими открытыми картами за столом пара, у него появляется дополнительная опция: он может поставить двойной размер малой ставки.

Игроки принимают решение по часовой стрелке. У каждого игрока имеются следующие опции: колл, рейз или фолд. Если на текущей улице еще не было ставок, игрок также может чекнуть.

Все рейзы во втором раунде торговли должны равняться малой ставке (за исключением ситуации, когда у игрока со старшими открытыми картами пара и он решил увеличить свою ставку до размера большой ставки).
"
7 Card Stud,Fifth Street,seven_card_stud_fifth_street,"After the second betting round has finished with all the current bets in the pot, each player still in the game is dealt one additional face-up card. A third betting round begins.

The first person to act is the player with the highest valued face-up cards. Their options are to check (bet nothing) or bet at the higher table limit. After that, the betting action moves clockwise around the table. Each player has the following options: call, raise or fold. With no prior betting, players can also check. 

Starting from the Fifth Street, all raised bets should be equal to the higher table limit.",seven_card_stud_fifth_street_0,,Fifth Street,"After the second betting round has finished with all the current bets in the pot, each player still in the game is dealt one additional face-up card. A third betting round begins.

The first person to act is the player with the highest valued face-up cards. Their options are to check (bet nothing) or bet at the higher table limit. After that, the betting action moves clockwise around the table. Each player has the following options: call, raise or fold. With no prior betting, players can also check. 

Starting from the Fifth Street, all raised bets should be equal to the higher table limit.",Die „Fifth Street“,"Wenn die zweite Einsatzrunde abgeschlossen ist und alle aktuellen Einsätze in den Pot eingezahlt wurden, wird jedem Spieler, der noch am Spiel teilnimmt, eine weitere offene Karte ausgeteilt. Es beginnt die dritte Einsatzrunde.

Der Spieler mit den höchstwertigen offenen Karten eröffnet die Runde. Er hat die Wahl, entweder zu schieben (keinen Einsatz zu entrichten) oder den Höchsteinsatz des Tisches zu setzen. Anschließend läuft die Einsatzrunde im Uhrzeigersinn um den Tisch. Jeder Spieler hat folgende Möglichkeiten: mitgehen, erhöhen oder aussteigen. Ohne vorherigen Einsatz haben Spieler auch die Möglichkeit zu schieben.

Ab der Fifth Street müssen alle Einsatzerhöhungen dem Höchsteinsatz des Tisches entsprechen.
",Quinta Calle,"Después de que la segunda ronda de apuestas termine con todas las apuestas en curso en el pozo, se reparte una carta adicional boca arriba a cada jugador que no se haya retirado del juego. Comienza una tercera ronda de apuestas.

La primera persona en actuar es el jugador que tenga las cartas boca arriba de mayor valor. Las opciones que tiene son las de pasar (no realizar ninguna apuesta) o apostar el límite máximo de la mesa. Después de eso, las apuestas se realizan de izquierda a derecha alrededor de la mesa. Cada jugador cuenta con estas opciones: igualar, subir o retirarse. Los jugadores también pueden pasar si no hay apuesta previa.

A partir de la Quinta Calle las subidas deben ser equivalentes al límite máximo de la mesa.
",Пятая улица,"После окончания второго раунда ставок, когда все текущие ставки собраны в банк, каждый оставшийся в раздаче игрок получает одну дополнительную открытую карту. Начинается третий раунд торговли.

Первым принимает решение игрок со старшими открытыми картами. Он может либо чекнуть (пропустить ставку), либо сделать большую ставку. После этого игроки принимают решение по часовой стрелке. У каждого игрока имеются следующие опции: колл, рейз или фолд. Если на текущей улице еще не было ставок, игрок также может чекнуть.

Начиная с пятой улицы, все рейзы должны быть равны большой ставке.
"
7 Card Stud,Sixth Street,seven_card_stud_sixth_street,"After the third betting round has finished with all the current bets in the pot, each player still in the game is dealt one additional face-up card. A fourth betting round begins. 

The first person to act is the player with the highest valued face-up cards. Their options are to check (bet nothing) or bet at the higher table limit. After that, the betting action moves clockwise around the table. Each player has the following options: call, raise or fold. With no prior betting, players can also check. 

All raised bets should be equal to the higher table limit.",seven_card_stud_sixth_street_0,,Sixth Street,"After the third betting round has finished with all the current bets in the pot, each player still in the game is dealt one additional face-up card. A fourth betting round begins. 

The first person to act is the player with the highest valued face-up cards. Their options are to check (bet nothing) or bet at the higher table limit. After that, the betting action moves clockwise around the table. Each player has the following options: call, raise or fold. With no prior betting, players can also check. 

All raised bets should be equal to the higher table limit.",Die „Sixth Street“,"Wenn die dritte Einsatzrunde abgeschlossen ist und alle aktuellen Einsätze in den Pot eingezahlt wurden, wird jedem Spieler, der noch am Spiel teilnimmt, eine weitere offene Karte ausgeteilt. Es beginnt die vierte Einsatzrunde.

Der Spieler mit den höchstwertigen offenen Karten eröffnet die Runde. Er hat die Wahl, entweder zu schieben (keinen Einsatz zu entrichten) oder den Höchsteinsatz des Tisches zu setzen. Anschließend läuft die Einsatzrunde im Uhrzeigersinn um den Tisch. Jeder Spieler hat folgende Möglichkeiten: mitgehen, erhöhen oder aussteigen. Ohne vorherigen Einsatz haben Spieler auch die Möglichkeit zu schieben.

Alle Einsatzerhöhungen müssen dem Höchsteinsatz am Tisch entsprechen.
",Sexta Calle,"Después de que la tercera ronda de apuestas termine con todas las apuestas en curso en el pozo, se reparte una carta adicional boca arriba a cada jugador que no se haya retirado del juego. Comienza una cuarta ronda de apuestas.

La primera persona en actuar es el jugador que tenga las cartas boca arriba de mayor valor. Las opciones que tiene son las de pasar (no realizar ninguna apuesta) o apostar el límite máximo de la mesa. Después de eso, las apuestas se realizan de izquierda a derecha alrededor de la mesa. Cada jugador cuenta con estas opciones: igualar, subir o retirarse. Los jugadores también pueden pasar si no hay apuesta previa.

Todas las subidas deberán ser equivalentes al límite máximo de la mesa.
",Шестая улица,"После окончания третьего раунда ставок, когда все текущие ставки собраны в банк, каждый оставшийся в раздаче игрок получает одну дополнительную открытую карту. Начинается четвертый раунд торговли.

Первым принимает решение игрок со старшими открытыми картами. Он может либо чекнуть (пропустить ставку), либо сделать большую ставку. После этого игроки принимают решение по часовой стрелке. У каждого игрока имеются следующие опции: колл, рейз или фолд. Если на текущей улице еще не было ставок, игрок также может чекнуть.

Все рейзы должны быть равны большой ставке.
"
7 Card Stud,The River,seven_card_stud_river,"After the fourth betting round has finished with all the current bets in the pot, each player still in the game is dealt a final face-down hole card. The fifth and last betting round begins. It is called the river.

The first person to act is the player with the highest valued face-up cards. Their options are to check (bet nothing) or bet at the higher table limit. After that, the betting action moves clockwise around the table. Each player has the following options: call, raise or fold. With no prior betting, players can also check. 

All raised bets should be equal to the higher table limit.",seven_card_stud_river_0,,The River,"After the fourth betting round has finished with all the current bets in the pot, each player still in the game is dealt a final face-down hole card. The fifth and last betting round begins. It is called the river.

The first person to act is the player with the highest valued face-up cards. Their options are to check (bet nothing) or bet at the higher table limit. After that, the betting action moves clockwise around the table. Each player has the following options: call, raise or fold. With no prior betting, players can also check. 

All raised bets should be equal to the higher table limit.",Der „River“,"Wenn die vierte Einsatzrunde abgeschlossen ist und alle aktuellen Einsätze in den Pot eingezahlt wurden, wird jedem Spieler, der noch am Spiel teilnimmt, eine letzte, verdeckte Taschenkarte ausgeteilt. Es beginnt die fünfte und letzte Einsatzrunde. Diese wird auch als „River“ bezeichnet.

Der Spieler mit den höchstwertigen offenen Karten eröffnet die Runde. Er hat die Wahl, entweder zu schieben (keinen Einsatz zu entrichten) oder den Höchsteinsatz des Tisches zu setzen. Anschließend läuft die Einsatzrunde im Uhrzeigersinn um den Tisch. Jeder Spieler hat folgende Möglichkeiten: mitgehen, erhöhen oder aussteigen. Ohne vorherigen Einsatz haben Spieler auch die Möglichkeit zu schieben.

Alle Einsatzerhöhungen müssen dem Höchsteinsatz am Tisch entsprechen.
",El river,"Después de que la cuarta ronda de apuestas termine con todas las apuestas en curso en el pozo, se reparte una carta adicional boca arriba a cada jugador que no se haya retirado del juego. Comienza la quinta y última ronda de apuestas. Se llama river.

La primera persona en actuar es el jugador que tenga las cartas boca arriba de mayor valor. Las opciones que tiene son las de pasar (no realizar ninguna apuesta) o apostar el límite máximo de la mesa. Después de eso, las apuestas se realizan de izquierda a derecha alrededor de la mesa. Cada jugador cuenta con estas opciones: igualar, subir o retirarse. Los jugadores también pueden pasar si no hay apuesta previa.

Todas las subidas deberán ser equivalentes al límite máximo de la mesa.
",Ривер,"После окончания четвертого раунда ставок, когда все текущие ставки собраны в банк, каждый оставшийся в раздаче игрок получает последнюю, закрытую карту. Начинается пятый и последний раунд торговли. Он называется ривером.

Первым принимает решение игрок со старшими открытыми картами. Он может либо чекнуть (пропустить ставку), либо сделать большую ставку. После этого игроки принимают решение по часовой стрелке. У каждого игрока имеются следующие опции: колл, рейз или фолд. Если на текущей улице еще не было ставок, игрок также может чекнуть.

Все рейзы должны быть равны большой ставке.
"
7 Card Stud,Showdown,seven_card_stud_showdown,"After the fifth and final betting round ends with all the money in the pot, it is time for the players who are still in the game to reveal their cards. A showdown is possible only if more than one player remains in the hand. 

The winner is the player with the best five-card combination also known as the hand. If only one player gets to this stage, they will win all the money in the pot.",seven_card_stud_showdown_0,,Showdown,"After the fifth and final betting round ends with all the money in the pot, it is time for the players who are still in the game to reveal their cards. A showdown is possible only if more than one player remains in the hand. 

The winner is the player with the best five-card combination also known as the hand. If only one player gets to this stage, they will win all the money in the pot.",Der Showdown,"Wenn die fünfte und letzte Einsatzrunde abgeschlossen ist und alle Einsätze in den Pot eingezahlt wurden, müssen alle Spieler, die noch am Spiel teilnehmen, ihre Karten aufdecken. Ein Showdown ist nur möglich, wenn mehr als ein aktiver Spieler übrig ist.

Gewinner ist der Spieler mit der besten Kombination aus fünf Karten, die auch als Hand bezeichnet wird. Wenn zu diesem Zeitpunkt nur noch ein Spieler übrig ist, gewinnt dieser automatisch alles Geld im Pot.
",Mostrar las cartas,"Una vez finalice la quinta y última ronda de apuestas y todo el dinero esté en el pozo, aquellos jugadores que aún sigan en el juego deberán mostrar sus cartas. Solo es posible mostrar las cartas si hay más de un jugador en la mano.

El ganador será aquel jugador que cuente con la mejor combinación de cinco cartas, también denominada “la mano”. Si a este punto de la partida solo llega un jugador, este será quien gane todo el dinero del pozo.
",Шоудаун,"После пятого и последнего раунда торговли для всех оставшихся в розыгрыше игроков наступает время открыть свои комбинации. Шоудаун возможен только в том случае, если в раздаче осталось двое или больше игроков.

Победителем становится игрок, который сможет собрать лучшую пятикарточную комбинацию (покерная рука). Если до этой стадии добирается только один игрок, он выигрывает весь банк.
"
