title,en_title,de_title,es_title,ru_title,data,card_1,card_1_status,card_2,card_2_status,card_3,card_3_status,card_4,card_4_status,card_5,card_5_status,en_description,de_description,es_description,ru_description,possibility,menu_card_1,menu_card_2,menu_card_3,menu_card_4,menu_card_5
Royal flush,Royal flush,Royal flush,"Escalera real","Флеш-рояль",royal_flush,1.svg,active,13.svg,active,12.svg,active,11.svg,active,10.svg,active,"Royal flush is the absolute best possible card combination in poker. It contains five cards of the same suit, in sequence from 10 to Ace. It is an unbeatable hand and you can be sure you win the pot or at least some part of it.

Remember, that all suits are equal in poker games. It may be a situation when two or more players hold a royal flush but is highly unlikely. In this case the pot is split between those two players.

Royal flush is a kind of straight flush and is considered the most rare poker hand combination. There are only four possible royal flush hands, one for each suit. The chances of you being dealt a royal flush are very minimal, only 0.00015%. However, if you are lucky you can confidently place an all-in with a royal flush. ","Der Royal Flush ist die absolut beste mögliche Kartenkombination beim Poker. Er besteht aus fünf Karten derselben Farbe, aufsteigend von der 10 bis zum Ass. Diese Hand kann nicht übertroffen werden und Sie können sicher sein, den Pot oder zumindest einen Teil davon zu gewinnen.

Denken Sie daran, beim Poker sind alle Spielkartenfarben gleichwertig. Es kann vorkommen, dass zwei oder mehr Spieler einen Royal Flush auf der Hand haben, aber dies ist höchst unwahrscheinlich. In solch einem Fall wird der Pot zwischen diesen Spielern aufgeteilt.

Der Royal Flush ist eine Art des Straight Flush und wird als die seltenste Pokerhand-Kombination angesehen. Es gibt nur vier mögliche Royal-Flush-Hände, eine für jede Kartenfarbe. Die Chance, einen Royal Flush zu erhalten, ist minimal und liegt bei 0,00015 %. Wenn Sie jedoch das Glück haben, dann können Sie mit einem Royal Flush mit 100%iger Sicherheit All-In gehen. 
","La escalera real es la mejor combinación de cartas posible en el poker. Está formada por cinco cartas del mismo palo en orden desde el 10 hasta el as. Es una mano invencible y puedes estar seguro de que ganarás el bote, o al menos una parte.

Recuerda: todos los palos valen lo mismo en las partidas de poker. Puede darse una situación en la que dos o más jugadores consigan una escalera real, pero es muy poco probable. En ese caso, el bote se divide entre los dos jugadores.

La escalera real es un tipo de escalera de color y está considerada como la combinación más insólita de las manos de poker. Solo hay cuatro posibles manos de escalera real, una por cada palo. La probabilidad de que recibas una escalera real es mínima, solo un 0,00015 %. No obstante, si tienes esa suerte, puedes hacer un all-in con una escalera real con total tranquilidad. 
","Флеш-рояль — это самая лучшая комбинация карт в покере. Она состоит из пять карт одной масти, по порядку, от 10 до туза. Эту руку невозможно побить, и вы можете быть уверены, что выиграете с ней банк или хотя бы его часть.

Помните, что в покерных играх все масти равноценны. Ситуация, когда двое и более игроков собрали флеш-рояль, возможна, но крайне маловероятна. В этом случае банк делится между этими двумя игроками.

Флеш-рояль — это вид стрейт-флеша и считается самой редкой покерной комбинацией. Существует только четыре возможных флеш-рояля, по одному для каждой масти. Шансы собрать флеш-рояль минимальны, всего лишь 0,00015%. Однако если вам все же повезло, с флеш-роялем вы можете спокойно идти олл-ин. 
",0.0015%,10.svg,11.svg,12.svg,13.svg,1.svg
Straight flush,Straight flush,Straight flush,"Escalera de color","Стрейт-флеш",straight_flush,5.svg,active,6.svg,active,7.svg,active,8.svg,active,9.svg,active,"Straight flush is the highest of all poker hands. It consists of five cards in sequence, all of the same suit. If there are more than one straight flush at showdown, the one containing the highest top card wins the pot
Bearing in mind that all suits in poker are equal, in an event of multiple players reviling a straight flush with the same cards value the pot is split between them. The ace (A) can be used as both the highest (A - K - Q - J - 10) and the lowest card (5 - 4 - 3 - 2 - A). In the first example, the hand is a royal flush - the best possible five-card combination. The second example shows the lowest possible straight flush.

There are 40 possible straight flushes, including four royal flushes in poker. The chances of you being dealt a straight flush are pretty slim at just 0.00139%.","Der Straight Flush ist die höchste aller Pokerhände. Er besteht aus fünf Karten in Reihenfolge, alle von derselben Kartenfarbe. Gibt es beim Showdown mehr als einen Straight Flush, dann gewinnt der Spieler mit der höchsten Karte den Pot.

Da beim Poker alle Kartenfarben gleichwertig sind, kann es vorkommen, dass mehrere Spieler einen Straight Flush mit demselben Kartenwert vorweisen. In diesem Fall wird der Pot zwischen ihnen aufgeteilt. Das Ass (A) kann sowohl als höchste (A - K - Q - J - 10) als auch als niedrigste Karte (5 - 4 - 3 - 2 - A) stehen. Im ersten Beispiel handelt es sich bei der Hand um einen Royal Flush – die bestmögliche 5-Karten-Kombination. Das zweite Beispiel zeigt den niedrigsten möglichen Straight Flush.

Beim Poker gibt es 40 mögliche Straight Flushs, einschließlich der vier Royal Flushs. Die Chancen, dass Ihnen ein Straight Flush ausgeteilt wird, sind mit 0,00139 % ziemlich gering.
","La escalera de color es la mano de poker más alta de todas. Consiste en cinco cartas seguidas, todas del mismo palo. Si hay más de una escalera de color cuando se muestran todas las cartas, gana el bote aquella que contenga las cartas más altas
Teniendo en cuenta que todos los palos en el poker tienen el mismo valor, en caso de que varios jugadores tengan una escalera de color con cartas del mismo valor, el bote se divide entre ellos. El as (A) se puede utilizar tanto como la carta más alta (A - K - Q - J - 10) y como la carta más baja (5 - 4 - 3 - 2 - A). En el primer ejemplo, la mano es una escalera real: la mejor combinación posible con cinco cartas. El segundo ejemplo muestra la escalera de color más baja posible.

Hay 40 escaleras de color posibles, incluidas cuatro escaleras reales en poker. La probabilidad de que recibas una escalera de color es bastante baja, solo del 0,00139 %.
","Стрейт-флеш — это самый старший вид покерной комбинации. Он состоит из пяти карт по порядку, все одной масти. Если на шоудауне игроки показывают несколько стрейт-флешей, выигрывает тот, чья верхняя карта старше.

Учитывая, что все масти в покере равноценны, в случае, когда сразу несколько игроков собирают стрейт-флеш из карт одного ранга, банк между ними делится. Туз (A) может быть использован, как старшая карта (A - K - Q - J - 10) или как младшая (5 - 4 - 3 - 2 - A). В первом примере комбинация называется флеш-роялем. Это лучшая возможная комбинация в покере. Второй пример — это самый младший из возможных стрейт-флешей.

Всего в покере существует 40 стрейт-флешей, включая четыре флеш-рояля. Шансы собрать стрейт-флеш весьма малы, всего 0,00139%.
",0.00139%,15.svg,16.svg,17.svg,18.svg,19.svg
Four of a kind,Four of a kind,Vierling,"Poker","Каре",four_of_kind,11.svg,active,24.svg,active,37.svg,active,50.svg,active,17.svg,passive,"Four-of-a-kind or also known as quads is the next highest ranking hand after the starting flush. It consists of any four cards with the same rank and any other card. If there are more than one player with a quads at showdown, the player with the highest four cards wins the pot. 

In poker games with community cards, if two or more players share the same four-of-a-kind, the winner is decided by the bigger fifth card, also known as the ‘kicker’.

There are 624 possible four-of-a-kind hands. The best one contains four aces, the lowest is made up of 2 - 2 - 2 - 2. The chances of being dealt a quads are also very rare at 0.024%.","Der Vierling, auch bekannt als Four-of-a-kind, ist die nächst höhere Hand nach dem Starting Flush. Er besteht aus beliebigen vier Karten vom gleichen Wert sowie einer beliebigen weiteren Karte. Gibt es beim Showdown mehrere Spieler mit einem Vierling, dann gewinnt derjenige mit den höchsten vier Karten den Pot.

In Pokerspielen mit Gemeinschaftskarten können mehrere Spieler denselben Vierling haben. Der Gewinner ist dann derjenige mit der höchsten fünften Karte, auch als „Kicker“ bezeichnet.

Es gibt 624 Möglichkeiten für eine Hand mit einem Vierling. Die beste besteht aus vier Assen, die niedrigste aus 2 - 2 - 2 - 2. Die Chancen, einen Vierling zu erhalten, sind mit 0,024 % immer noch sehr niedrig.
","El poker es la siguiente mano más alta de la lista después de la escalera de color. Consiste en cuatro cartas cualesquiera del mismo valor y cualquier otra carta. Si hay más de un jugador con un poker cuando se muestran todas las cartas, el jugador con las cuatro cartas más altas gana el bote.

En partidas de poker con cartas comunes, si dos o más jugadores comparten el mismo poker, se elige como ganador al que tenga la quinta carta más alta, también conocida como “kicker”.

Hay 624 manos de poker posibles. La mejor está formada por cuatro ases, la más baja la forma la combinación 2 - 2 - 2 - 2. La probabilidad de que recibas un poker también es muy baja, del 0,024 %.
","Каре — это следующая по старшинству комбинация после стрейт-флеша. Она состоит из четырех карт одинакового ранга и любой другой карты. Если на шоудауне несколько игроков показали каре, выигрывает комбинация из карт старшего ранга.

В покерных играх с общими картами возможна ситуация, когда у участников банка оказалось одинаковое каре. В таком случае победитель определяется старшинством пятой карты, также известной как ""кикер"".

Существует 624 возможные комбинации каре. Лучшая из них состоит из четырех тузов, самая младшая — 2 - 2 - 2 - 2. Шансы собрать каре также невелики, 0,024%.",0.024%,17.svg,51.svg,38.svg,25.svg,12.svg
Full house,Full house,"Full House","Full","Фулл-хаус",full_house,51.svg,active,38.svg,active,25.svg,active,33.svg,active,7.svg,active,"Full house is the next highest ranking hand after four-of-a-kind. It has three matching cards of one rank and two matching cards of a different rank. If there are more that one full houses at the showdown, the player with highest rank of the three cards wins the pot. In poker games with community cards, it is possible that several players share three matching cards from the board. In this case, the player with the higher pair wins the pot. 

There are 3.744 possible combinations of a full house. The highest possible is three aces and two kings (A - A - A - K - K) and the lowest is 2 - 2 - 2 - 3 - 3. The probability of being dealt a full house is 0.1441%.","Das Full House ist die nächsthöhere Hand nach dem Vierling. Es besteht aus drei Karten eines Kartenwertes und zwei Karten eines anderen Kartenwertes. Gibt es beim Showdown mehrere Full Houses, dann gewinnt der Spieler mit den drei höchsten Karten den Pot. In Pokerspielen mit Gemeinschaftskarten besteht die Möglichkeit, dass mehrere Spieler drei gleichwertige Karten vom Board teilen. In diesem Fall gewinnt der Spieler mit dem höheren Paar den Pot.

Es gibt 3744 mögliche Kombinationen für ein Full House. Die höchstmögliche besteht aus drei Assen und zwei Königen (A - A - A - K - K), die niedrigste aus 2 - 2 - 2 - 3 - 3. Die Wahrscheinlichkeit, ein Full House zu erhalten, liegt bei 0,1441 %.
","El full es la siguiente mano más alta de la lista después del poker. Contiene tres cartas iguales del mismo valor y dos cartas iguales de otro valor. Si hay más de un full cuando se muestran todas las cartas, el jugador con el valor más alto de las tres cartas gana el bote. En partidas de poker con cartas comunes, es posible que varios jugadores compartan tres cartas iguales de la mesa. En ese caso, el jugador con la pareja más alta gana el bote.

Hay 3.744 combinaciones de full posibles. La combinación más alta posible consiste en tres ases y dos reyes (A - A - A - K - K) y la más baja en 2 - 2 - 2 - 3 - 3. La probabilidad de que recibas un full es del 0,1441 %.
","Фулл-хаунс следует по старшинству за каре. В нем три карты одного ранга и две карты другого. На шоудауне среди нескольких фулл-хаусов выигрывает тот, чьи три карты одинакового ранга старше. В покерных играх с общими картами несколько игроков могут использовать одни и те же три карты одинакового ранга, лежащие на столе. В таком случае выигрывает фулл-хаус, в котором ранг двух других карт старше.

Существует 3.744 возможные комбинации фулл-хауса. Старшая состоит из трех тузов и двух королей (A - A - A - K - K), а младшая — 2 - 2 - 2 - 3 - 3. Вероятность собрать фулл-хаус равна 0,1441%.",0.1441%,49.svg,10.svg,39.svg,13.svg,26.svg
Flush,Flush,Flush,"Color","Флеш",flush,39.svg,active,36.svg,active,35.svg,active,31.svg,active,30.svg,active,"Flush is rather strong poker hand. It consists of any five cards of the same suit, but not in sequence. If there are more than one flushes at showdown, the player with the highest top card wins the pot. If both players have the same highest card in a hand, the second highest card is compared, and so on, until a difference is found. If there is no difference between the two hands, the players split the pot. Remember, the suits are equal in poker, so it makes no odds which suit you use to form a hand. 

There are 5.108 possible combinations and chances of being dealt a flush are 0.1965%.","Der Flush ist eine ziemlich starke Pokerhand. Er besteht aus fünf Karten einer Farbe, jedoch nicht in Reihenfolge. Gibt es beim Showdown mehr als einen Flush, dann gewinnt der Spieler mit der höchsten Karte den Pot. Haben zwei Spieler die gleiche höchste Karte in ihrer Hand, dann wird die zweithöchste verglichen usw. bis eine Differenz gefunden wird. Gibt es keine Unterschiede zwischen den beiden Händen, teilen sich die Spieler den Pot. Denken Sie daran, dass Kartenfarben im Poker gleichwertig sind. Es macht also keinen Unterschied, aus welcher Farbe Sie Ihre Hand bilden.

Es gibt 5108 mögliche Kombinationen und die Chance, einen Flush zu erhalten, liegt bei 0,1965 %.
","El color es una mano de poker bastante fuerte. Consiste en cinco cartas cualesquiera del mismo palo, pero no seguidas. Si hay más de un color cuando se muestran todas las cartas, gana el bote el jugador que contenga las cartas más altas. Si dos jugadores tienen la misma carta más alta en una mano, se comparan las segundas cartas más altas y así sucesivamente, hasta que se encuentre una diferente. Si no hay diferencias entre las dos manos, los jugadores se reparten el bote. Recuerda: los palos tienen el mismo valor en el poker, así que no importa qué palo utilices para formar una mano.

Hay 5.108 combinaciones posibles y la probabilidad de que recibas un color es del 0,1965 %.
","Флеш — это довольно сильная покерная комбинация. Она состоит из пяти любых карт одинаковой масти, необязательно по порядку. Если на шоудауне оказывается несколько флешей, победитель определяется рангом старшей карты. Если старшая карта у несколько игроков одинакова, смотрится ранг следующей по старшинству карты комбинации и т.д., пока не будет определен победитель. Если флеши абсолютно одинаковы, банк делится. Помните, что в покере масти равноценны, поэтому масть флеша не имеет значения.

Существует 5108 возможных комбинаций флеша, а шансы собрать его равны 0,1965%.
",0.1965%,16.svg,18.svg,21.svg,24.svg,14.svg
Straight,Straight,Straße,"Escalera","Стрейт",straight,46.svg,active,45.svg,active,31.svg,active,17.svg,active,3.svg,active,"Straight is a poker hand that contains any five connected cards in sequence with at least two different suits. If there are two or more straight hands at showdown, the player with the highest top card wins the pot. If the highest card in all the straights is of the same rank, the pot is split among the players. All suits are equal in poker, they can not be used to determine a winner. 

The ace in a straight may be used as both a high (A - K - Q - J - 10) and low (5 - 4 - 3 - 2 - A) card. The first example, known as ‘Broadway’’, shows the highest ranking straight. In contract to the second example called the ‘wheel’ in poker terms, which is the lowest possible straight. 

There are 10.240 possible straight combinations, making it a 0.39% chance of being dealt one.","Die Straße (Straight) ist eine Pokerhand, die aus fünf Karten in einer Reihenfolge und aus mindestens zwei verschiedenen Kartenfarben besteht. Gibt es beim Showdown mehr als eine Straße, dann gewinnt der Spieler mit der höchsten Karte den Pot. Ist die höchste Karte bei den Straßen gleichrangig, dann wird der Pot zwischen den Spielern aufgeteilt. Beim Poker sind alle Spielkartenfarben gleichwertig, sie können nicht zur Bestimmung eines Gewinners verwendet werden.

Das Ass (A) kann in einer Straße sowohl als höchste (A - K - Q - J - 10) als auch als niedrigste Karte (5 - 4 - 3 - 2 - A) stehen. Das erste Beispiel, auch bekannt als „Broadway“, zeigt die höchste Straße. Im Gegensatz dazu ist das zweite Beispiel, in der Pokersprache „Wheel“ genannt, die niedrigste mögliche Straße.

Es gibt 10.240 mögliche Straßen-Kombinationen und damit eine 0,39%ige Chance, eine Straße ausgeteilt zu bekommen.
","La escalera es una mano de poker formada por cinco cartas cualesquiera conectadas y seguidas con al menos dos palos diferentes. Si hay dos o más escaleras cuando se muestran todas las cartas, el jugador con las cartas más altas gana el bote. Si la carta más alta en todas las escaleras es del mismo valor, el bote se divide entre los jugadores. Todos los palos tienen el mismo valor en el poker y no se pueden utilizar para determinar un ganador.

El as en una escalera puede utilizarse como una carta alta (A - K - Q - J - 10) o como una carta baja (5 - 4 - 3 - 2 - A). El primer ejemplo, conocido como “Broadway”, muestra la escalera del valor más alto. En cambio, en el segundo ejemplo aparece la “ruleta”, que en términos de poker es la escalera más baja posible.

Hay 10.240 combinaciones posibles de escalera, de forma que la probabilidad de que recibas una es del 0,39 %.
","Стрейт — это покерная комбинация из пяти карт по порядку и с как минимум двумя разными мастями. Из нескольких стрейтов на шоудауне выигрывает тот, чья верхняя карта старше. Если старшая карта во всех стрейтах одинакова, банк делится. Все масти в покере равноценны, поэтому они не могут использоваться для определения победителя.

Туз (A) в стрейте может быть использован, как старшая карта (A - K - Q - J - 10) или как младшая (5 - 4 - 3 - 2 - A). В первом примере стрейт называется ""бродвеем"". Это старший возможный стрейт. Второй же пример стрейта на покерном жаргоне носит название ""колесо"", это самый младший стрейт в покере.

Существует 10.240 возможных комбинаций стрейта, а шансы собрать его составляют 0,39%.
",0.39%,31.svg,45.svg,7.svg,21.svg,48.svg
